{
  "$schema": "http://json-schema.org/draft-07/schema#",
  "$id": "gate-authorization-record.schema.json",
  "title": "In-repo Gate authorization record (pinned by the AUTHORIZATION ledger event)",
  "description": "Factual, agent-authored description of exactly one NOT_STARTED -> AUTHORIZED_NOT_STARTED transition and the Gate's first sealed state revision (R0001). It grants nothing on its own: the granting document is the owner-signed ACTIVE_GATE_AUTHORIZATION_AUTHORITY, joined to this record by a recomputed binding digest. START and execution privilege are not representable. NOTE ON ENFORCEMENT: this repository's canonical schema validator implements a draft-07 SUBSET (type, const, enum, pattern, minLength, minimum, minItems, uniqueItems, required, properties, additionalProperties, items). This schema therefore deliberately avoids $ref/definitions/allOf/contains/maxItems, which would be silently ignored and give a false impression of strictness. The constraints that cannot be expressed here — exact cohort cardinality of 4, exact per-role repository path templates, completeness of prohibitedOperations, and every digest/signature binding — are enforced normatively in governance/gee-v1/core/gate-authorization-authority.mjs and re-enforced permanently in governance/tools/validate-status-ledger.mjs.",
  "type": "object",
  "additionalProperties": false,
  "required": [
    "schemaVersion", "document", "authorizationId", "projectId", "gateId", "purpose",
    "transitionType", "fromStatus", "toStatus", "recordedAt", "baseCommit",
    "preLedgerSha256", "previousEventSha256", "contractSha256", "currentContractSha256",
    "dependencyProof", "stateRevision", "authorizedStateArtifacts", "authorizedDerivedArtifacts",
    "prohibitedOperations", "executionAuthorized", "reason"
  ],
  "properties": {
    "schemaVersion": { "const": 1 },
    "authorityMode": { "enum": ["LEGACY_SIGNED_AUTHORITY", "LOCAL_EXPLICIT_AUTHORITY"] },
    "document": { "const": "GATE_AUTHORIZATION_RECORD" },
    "authorizationId": { "type": "string", "pattern": "^GATE_AUTHORIZATION_[A-Z0-9_]{3,64}$" },
    "projectId": { "type": "string", "minLength": 1 },
    "gateId": { "type": "string", "minLength": 1 },
    "purpose": { "const": "GATE_NORMAL_AUTHORIZATION" },
    "transitionType": { "const": "AUTHORIZATION" },
    "fromStatus": { "const": "NOT_STARTED" },
    "toStatus": { "const": "AUTHORIZED_NOT_STARTED" },
    "recordedAt": { "type": "string", "minLength": 20 },
    "baseCommit": { "type": "string", "pattern": "^[a-f0-9]{40}$" },
    "preLedgerSha256": { "type": "string", "pattern": "^[a-f0-9]{64}$" },
    "previousEventSha256": { "type": "string", "pattern": "^[a-f0-9]{64}$" },
    "contractSha256": { "type": "string", "pattern": "^[a-f0-9]{64}$" },
    "currentContractSha256": { "type": "string", "pattern": "^[a-f0-9]{64}$" },
    "dependencyProof": {
      "type": "object",
      "additionalProperties": false,
      "required": ["gateId", "status", "authorityPath", "authoritySha256"],
      "properties": {
        "gateId": { "type": "string", "minLength": 1 },
        "status": { "enum": ["COMPLETE_AGENT", "COMPLETE_CONFIRMED", "SUPERSEDED"] },
        "authorityPath": { "type": "string", "minLength": 1 },
        "authoritySha256": { "type": "string", "pattern": "^[a-f0-9]{64}$" }
      }
    },
    "stateRevision": { "const": "R0001" },
    "authorizedStateArtifacts": {
      "type": "array",
      "minItems": 4,
      "uniqueItems": true,
      "items": {
        "type": "object",
        "additionalProperties": false,
        "required": ["cohortRole", "repoRelativePath", "sha256", "byteLength"],
        "properties": {
          "cohortRole": { "enum": ["CURRENT_STATE", "CHECKPOINT", "OPEN_DEFECTS", "STATE_SEAL"] },
          "repoRelativePath": { "type": "string", "pattern": "^governance/gates/[^/*?\\\\]+/state/[^*?\\\\]+$" },
          "sha256": { "type": "string", "pattern": "^[a-f0-9]{64}$" },
          "byteLength": { "type": "integer", "minimum": 0 }
        }
      }
    },
    "authorizedDerivedArtifacts": {
      "description": "PATH-ONLY by construction. The record is frozen and pinned by the AUTHORIZATION ledger event; the four derived views are regenerated AFTER that event, because regenerating them is what consumes the new ledger state. At the moment these bytes are frozen the post-authorization derived bytes do not exist, so a record declaring their hashes would be claiming to know the future. The owner authority is signed last and carries the full post-authorization derived hashes instead.",
      "type": "array",
      "minItems": 4,
      "uniqueItems": true,
      "items": {
        "type": "object",
        "additionalProperties": false,
        "required": ["cohortRole", "repoRelativePath"],
        "properties": {
          "cohortRole": { "enum": ["GATE_STATUS_SNAPSHOT", "ACTIVE_GATE", "ACTIVE_GATE_CONTEXT_JSON", "ACTIVE_GATE_CONTEXT_MD"] },
          "repoRelativePath": { "enum": ["governance/state/generated/GATE_STATUS_SNAPSHOT.json", "governance/active/ACTIVE_GATE.json", "governance/generated/ACTIVE_GATE_CONTEXT.json", "governance/generated/ACTIVE_GATE_CONTEXT.md"] }
        }
      }
    },
    "prohibitedOperations": {
      "type": "array",
      "minItems": 11,
      "uniqueItems": true,
      "items": {
        "enum": [
          "START", "GATE_EXECUTION", "AGENT_CLOSURE", "EXTERNAL_CONFIRMATION", "COMPLETE_CONFIRMED",
          "ARBITRARY_LEDGER_TRANSITION", "LEDGER_REWRITE", "GIT_PUSH", "ARBITRARY_GOVERNANCE_WRITE",
          "OTHER_GATE", "GEE_REVISION_CREATION"
        ]
      }
    },
    "executionAuthorized": { "const": false },
    "reason": { "type": "string", "minLength": 1 }
  }
}
